,heading,content,keyword
0,李开复旗下创新奇智成立新公司,启信宝数据显示，2月26日，李开复担任董事长的深圳创新奇智科技有限公司新增对外投资，成立创新奇智（成都）科技有限公司，法定代表人为徐辉，注册资本1000万人民币。启信宝显示，2019年1月24日，深圳创新奇智科技有限公司刚刚获得4亿人民币的A轮融资。深圳创新奇智科技有限公司为创新工场AI子公司，专注于AI+B2B企业服务。,"[('奇智', 0.8694376365745454), ('创新', 0.5218846360363636), ('启信宝', 0.4347188182872727), ('AI', 0.4347188182872727), ('科技', 0.42416543224799996)]"
1,西安市三部门联合印发《西安市规范自动驾驶车辆测试指导意见（试行）》,为优化汽车产业创新发展环境，积极支持并有效规范自动驾驶车辆开展相关测试工作，推动自动驾驶技术的发展和产业化应用，西安市三部门联合印发《西安市规范自动驾驶车辆测试指导意见（试行）》，意见指出，测试车辆及相关工作人员应在封闭的测试场地进行审查测试。通过审查测试的车辆及相关工作人员可在划定的开放区域开展自动驾驶车辆道路测试。,"[('测试', 0.8201750513714754), ('车辆', 0.5243760673196721), ('驾驶', 0.47417570899147543), ('自动', 0.4250030864957377), ('西安市', 0.30477073658983606)]"
2,联想总裁杨元庆减持联想智慧医疗股份,启信宝数据显示，2月27日，杨元庆持股北京联想智慧医疗信息技术有限公司的比例从1.89%下降至1.25%。2月12日，北京联想智慧医疗信息技术有限公司发生多项工商变更，其中董事长由贺志强变更为TANSINTIN，注册资本由8966.74万元增至19246.861925万元。,"[('信息技术', 0.4238916948107692), ('联想', 0.39488043476564105), ('智慧', 0.37907223153846153), ('变更', 0.3464754088025641), ('医疗', 0.33727420952666665)]"
3,中国成为全球最大金融科技投资市场,埃森哲最新研究显示，2018年中国成为全球最大的金融科技投资市场。去年，全球金融科技投资总额增长超一倍，达到创纪录的553亿美元，中国市场贡献了超过四成（46%）的投资额，备受投资者的青睐。2018年，中国市场的金融科技投资总额增长了八倍，达到255亿美元，接近于2017年全球金融科技投资总额（267亿美元）。本次研究的数据来源于全球风险金融数据与分析机构CB Insights。,"[('投资总额', 0.4076203130658461), ('金融', 0.4039002576407692), ('2018', 0.36783900008923076), ('科技', 0.3589092119021538), ('全球', 0.3016643971501538)]"
4,拳打Adam，脚踢SGD：北大提出全新优化算法AdaBound,在论文《Adaptive Gradient Methods with Dynamic Bound of Learning Rate》中，研究人员提出了一种新型优化方法 AdaBound，「和 Adam一样快、和 SGD一样好」。据了解，四位作者 Liangchen Luo、Yuanhao Xiong、Yan Liu、Xu Sun 均来自国内。共同一作骆梁宸和 Yuanhao Xiong 分别来自北京大学和浙江大学，Yan Liu 来自南加州大学，Xu Sun 来自北京大学。而且一作骆梁宸是北京大学的本科生。作者在 reddit 网站发帖介绍了这项研究，并提供了 PyTorch 实现。他们目前在 MNIST 和 CIFAR-10 数据集做了测试，但由于计算资源有限而无法选择 ImageNet 等大数据集。此外，作者还表示 AdaBound 可以直接通过 pip 安装，不过使用 AdaBound 不意味着不用调参，只不过 AdaBound 可以帮助大家减少所需要的时间。,"[('AdaBound', 0.4597987501115384), ('Yuanhao', 0.2298993750557692), ('Xiong', 0.2298993750557692), ('Yan', 0.2298993750557692), ('Liu', 0.2298993750557692)]"
5,最高法院「五五改革纲要」出台，坚持强化人工智能等先进技术驱动成为纲要基本原则之一,为深入贯彻习近平总书记全面依法治国新理念新思想新战略，进一步深化新时代人民法院各项改革，最高人民法院制定了《关于深化人民法院司法体制综合配套改革的意见》，并将之作为《人民法院第五个五年改革纲要（2019—2023）》贯彻实施。《纲要》多处提及人工智能等先进技术，并强调充分运用大数据、云计算、人工智能等现代科技手段破解改革难题、提升司法效能，推动人民法院司法改革与智能化、信息化建设两翼发力，为促进审判体系和审判能力现代化提供有力科技支撑。,"[('人民法院', 0.43734932945859156), ('司法', 0.3136127328071831), ('人工智能', 0.2664232787461972), ('纲要', 0.2519676223766197), ('改革', 0.23197940278436618)]"
6,首款米家智能灯泡海外发售，将支持HomeKit,2月27日早间消息，在巴塞罗那近日举行的小米展前发布会上，小米面向海外市场发布了智能家居产品米家LED智能灯泡。据悉，米家LED智能灯泡由小米同小米生态链公司Yeelight共同研发，在欧洲市场售价为19.99欧元。这款产品主打智能调光、远程控制、语音交互等特色，可以自动调节色温和亮度，亮度可达800流明，寿命可达11年。除了支持小米自家的米家APP智能家居平台外，这款智能灯泡目前还支持Google Assistant、Amazon Alexa等主流IoT平台，并将于近期加入对Apple HomeKit的支持。值得注意的是，这也将成为小米首款支持Apple HomeKit的智能灯泡。,"[('小米', 0.6109652802386666), ('灯泡', 0.42591953504177776), ('智能', 0.3977865717983334), ('智能家居', 0.2935006771422222), ('米家', 0.26566150006444444)]"
7,小米宣布新一轮组织架构调整：任命崔宝秋为集团副总裁，原AI与云平台部一分为三,小米集团组织部于2月26日下发正式文件，宣布了最新一轮组织架构调整：任命崔宝秋为集团副总裁、集团技术委员会主席，并且在核心管理岗位上共任命了14名总经理、副总经理，原人工智能与云平台部拆分为人工智能部、大数据部与云平台部三个部门。这是继去年9月成立集团组织部、参谋部以来，小米规模最大的一次组织架构调整。,"[('集团', 0.37912265147076923), ('人工智能', 0.3637702459803846), ('小米', 0.3524799693684615), ('组织部', 0.3465510970673077), ('架构', 0.3437628085276923)]"
8,科大讯飞业绩快报：2018年度净利润同比增长21.62%,科大讯飞发布业绩快报：2018年度该公司营收80.67亿元，同比增48.16%；归属公司股东的净利润为5.29亿元，同比增长21.62%。科大讯飞在报告中表示，报告期内，讯飞开放平台合作伙伴达92万，同比增长77.60%，以科大讯飞为中心的人工智能生态持续构建。（36氪）,"[('科大', 0.8561828251649999), ('同比', 0.40830630620174996), ('2018', 0.2988691875725), ('营收', 0.2988691875725), ('80.67', 0.2988691875725)]"
9,谷歌推广AI语法检查功能：将提供给所有G Suite用户,据The Verge报道，谷歌今天宣布将在Google Docs中面向所有G Suite用户默认提供人工智能语法检查器。普通的拼写检查功能会将疑似错误高亮显示，而语法检查器则会使用蓝色曲线来标记可能的错误。谷歌去年7月宣布了这项功能，但当时需要由系统管理员手动开启该功能，所以并没有默认开启。不过这些功能目前仅限于企业用户。（新浪科技）,"[('功能', 0.38679105128842106), ('检查', 0.31804263645473685), ('默认', 0.3105551454291228), ('语法', 0.3030872794059649), ('谷歌', 0.3002927508775438)]"
10,沃尔玛收购初创公司Aspectiva，或将通过分析UGC内容做商品推荐,2月27日消息，沃尔玛宣布收购了以色列初创公司Aspectiva，该公司通过人工智能技术分析社交平台的UGC内容（如客户的产品评论），并将其与购物者的浏览行为结合起来，为在线和实体店的购物者提供产品建议。这表明沃尔玛正在努力打造自己的电子商务体验，以便更好地与亚马逊平台竞争。（TechWeb）,"[('购物者', 0.6043772892173913), ('沃尔玛', 0.40873339050652174), ('平台', 0.2714930645891305), ('27', 0.25988625006304344), ('Aspectiva', 0.25988625006304344)]"
11,新研究探讨词嵌入中的幽默,人工智能领域的进步使得能够开发能够理解各种语言并与人类交流的工具。然而，人工智能系统仍然在人类交流的方方面面中有所挑战，其中之一就是幽默。来自牛津大学，微软研究院和TRASH的一组研究人员最近开展了一项调查词汇嵌入中幽默的研究。 Word嵌入是一种流行的AI工具，可以将单词与Euclidean向量相关联。（techexplore）,"[('人工智能', 0.350297273907037), ('嵌入', 0.34578998001888883), ('幽默', 0.31169928587), ('交流', 0.25117968158925924), ('工具', 0.22657235687555558)]"
12,日本造出世界首个机器人佛教神,"近日，日本京都高台寺用高达 909,090 美元成本造出机器人版的 Kannon，也就是日本的怜悯之神。这座寺庙也是世界上第一个将精神和科学领域融合在一起构建这座神殿的机器人神灵，并且计划让该机器人能够进行佛教布道。（mashable）","[('机器人', 0.6875791340027027), ('这座', 0.37489715169567567), ('寺用', 0.3231018244027027), ('909090', 0.3231018244027027), ('Kannon', 0.3231018244027027)]"
13,新加坡全球数据创新中心Dentsu Aegis Network推出人工智能撰稿人,近日，总部位于新加坡的全球数据创新中心Dentsu Aegis Network，创建了一个名为「项目 leo」的人工智能撰稿人。该机构的发言人表示：「该解决方案目前能够通过开发大量广告并利用谷歌的机器学习以及消费者意图匹配功能来生成谷歌搜索广告。「当为酒店客户执行时，点击率提高了 3％到 10％，每次点击费用降低了 30％到 42％。」该工具目前是该网络首个全球研发中心开发的一套解决方案之一。（mumbrella）,"[('解决方案', 0.25963511693060604), ('谷歌', 0.2593437393942424), ('广告', 0.2234157495257576), ('Dentsu', 0.18113284095303028), ('Aegis', 0.18113284095303028)]"
14,微软首席执行官为军队增强现实合同辩护,科技工作者对雇主与美国政府，特别是军方的工作越来越不安。一些抗议活动导致了真正的变化：在 4000 名员工签署请愿抗议该安排后，谷歌去年决定不再与五角大楼续签合同。上周，一群微软员工发表请愿书，要求高管们终止一份为美国军方开发增强现实技术的合同。「我们没有注册开发武器，我们要求对我们的工作使用方式发表意见，」该请愿书在 Twitter 上发布说。周一，微软首席执行官萨蒂亚纳德拉拒绝了这一请求。纳德拉在巴塞罗那举行的移动世界大会上对 CNN Business 表示：「我们做出了一项有原则的决定，即我们不会从我们在民主国家选出的机构中扣留技术来保护我们所享有的自由。」（Wired）,"[('我们', 0.24473428627762886), ('请愿书', 0.21648412928453606), ('德拉', 0.20022727649381442), ('微软', 0.1860923779127835), ('军方', 0.17606980384061854)]"
15,飞利浦、微软强强联合，通过新型VR技术打造未来手术室,在MWC 2019展会上，健康科技公司皇家飞利浦于2月26日推出一款与微软公司共同开发的未来手术室混合现实应用工具。基于飞利浦业界领先的Azurion图像引导治疗平台和微软HoloLens 2混合现实头戴式显示器（也称VR眼镜、VR头盔），两家公司将展示用于图像引导微创治疗的新型增强现实应用工具。,"[('VR', 0.46881441187843137), ('飞利浦', 0.42049505182745095), ('现实', 0.3608139479347059), ('图像', 0.30417615756274513), ('头戴式', 0.2725623069019608)]"
16,谷歌：利用AI预测风电站发电量，提高20%风能发电价值,据外媒报道，谷歌宣布，利用伦敦子公司 DeepMind 的机器学习算法来预测谷歌用于绿色能源计划的风力农场发电量，该公司现在可以更合理地安排能源输出时间。根据谷歌的说法，该软件已将这些农场提供的风能的「价值」提高了 20%。谷歌尚未对此置评。（腾讯科技）,"[('谷歌', 0.7607416355564444), ('农场', 0.3618567056933334), ('该软件', 0.26908707072666666), ('能源', 0.268278122088), ('外媒', 0.26566150006444444)]"
17,成都印发5G产业发展规划纲要:2022年将建5G基站4万个以上,成都市5G产业发展领导小组办公室日前印发《成都市5G产业发展规划纲要》，提出到2022年，要将该市建设成为5G网络供给全国领先、行业应用深度融合、核心生态高度汇聚、产业聚集效应凸显的中国5G创新名城。该文件提出：到2020年，实现城区重点区域5G网络连续覆盖；到2022年，建设5G基站4万个以上，实现重点城镇以上5G网络全覆盖。（四川日报）,"[('5G', 1.267929886671212), ('2022', 0.36226568190606057), ('网络', 0.2822489797477273), ('成都市', 0.2751635177687879), ('产业', 0.2483952052722727)]"
18,地平线宣布获6亿美元B轮融资，估值达30亿美元,2月27日消息，AI芯片公司地平线宣布获得6亿美金左右的B轮融资，由SK中国、SK Hynix以及数家中国一线汽车集团（与旗下基金）联合领投。本轮融资后，地平线估值达30亿美金。参与本轮融资的其他机构与战略合作伙伴包括：中国泛海控股集团旗下泛海投资、民银资本、中信里昂旗下CSOBOR基金和海松资本等。同时，本轮融资还获得了包括晨兴资本、高瓴资本、云晖资本和线性资本等现有股东加持。,"[('资本', 0.4128498005631429), ('SK', 0.34156478579714283), ('本轮', 0.3356679455884286), ('融资', 0.333542001012), ('亿美金', 0.30757666959999996)]"
19,大众或将向福特自动驾驶部门Argo AI投资17亿美元,2月27日消息，据《华尔街日报》援引知情人士报道，大众汽车集团计划向福特汽车旗下的自动驾驶部门Argo AI投资17亿美元。其中，6亿美元作为股权投资，大众和福特将分别占有一半股份，其余11亿美元将作为运营资本用于研发。福特在一份声明中表示，与大众在自动驾驶领域的商谈仍在继续，但拒绝直接证实或否认《华尔街日报》的报道的。,"[('福特', 0.4568304388821818), ('华尔街日报', 0.33555813881854546), ('亿美元', 0.31679054315127275), ('大众', 0.2678340502167273), ('驾驶', 0.2629519840770909)]"
20,著名硅谷孵化器Y Combinator：未来几十年全球GDP将因AI每年增长50%,近日，著名硅谷孵化器 Y Combinator 总裁山姆·奥尔特曼（Sam Altman）表示，未来几十年全球 GDP 将因 AI 每年增长 50%。,"[('Combinator', 0.6291982896263157), ('奥尔特曼', 0.6291982896263157), ('Sam', 0.6291982896263157), ('Altman', 0.6291982896263157), ('GDP', 0.6291982896263157)]"
21,英特尔与紫光展锐终止5G modem芯片合作,《日经亚洲评论》网站援引知情人士的消息称，英特尔已结束与中国芯片厂商紫光展锐在5G modem芯片上的合作。英特尔5G战略和项目办公室总经理罗伯特·托波尔在MWC上表示：“终止与紫光展锐合作的决定只是最近做出的。我们共同决定不再继续这种合作关系。”知情人士称，双方此次结束合作关系有多方面原因。除了外部因素，英特尔内部因素也有一定的关系。（新浪科技）,"[('英特尔', 0.44334498728859373), ('展锐', 0.373586484465625), ('5G', 0.373586484465625), ('合作', 0.344358011695625), ('紫光', 0.3097404251690625)]"
22,Google 将 Doc 中人工智能语法检查程序扩展到所有 G Suite 用户,谷歌今天宣布其人工智能驱动的语法检查器现在将成为谷歌文档中的一个原生功能，适用于 G Suite 的所有用户，这是其公司的网络工具和服务套件。谷歌去年 7 月宣布的语法检查程序由机器翻译提供支持，机器翻译是人工智能工具的一个子集，它支持软件的自然语言处理能力以及将文本从一种语言翻译成另一种语言的能力。（The Verge）,"[('谷歌', 0.534896462500625), ('机器翻译', 0.5121349891458333), ('人工智能', 0.3940844331454167), ('语法', 0.35991614429458335), ('检查程序', 0.27515688482083334)]"
23,谷歌人工智能智能基金 700 万美金投资越南「英语流利说」,谷歌的 Gradient Ventures 是搜索巨头专用的人工智能基金，在为 Elsa（一家为英语学习者运营应用程序的初创公司）带来 700 万美元的 A 轮融资后，正在将目光投向亚洲。这笔交易是 Gradient 在亚洲的首次交易，其中包括现有投资者 Monk's Hill Ventures 和 SOSV 的参与。艾尔莎迄今已筹集了 1200 万美元。Elsa 成立于 2015 年，旨在帮助非英语人士提高口音和一般口语能力。Vu Van，首席执行官和创始团队的一半，是一名越南国民，尽管英语流利，但在移居美国学习和工作后仍难以理解。与语音识别研究员 Xavier Anguera 博士（负责其葡萄牙技术团队的创业公司首席技术官）一起，Van 创立了 Elsa 帮助处于同样困境的人们。,"[('Elsa', 0.36596227049693875), ('Gradient', 0.24397484699795918), ('Ventures', 0.24397484699795918), ('Van', 0.24397484699795918), ('英语', 0.22716223745051017)]"
24,Reddit 热帖：优化器 AdaBound 兼备 Adam 和 SGD 特性,最近一个新研发的优化器在Reddit上引起热议。博主称，他们开发了一种名为 AdaBound 的新优化器，希望能够在无法看到的数据上实现更快的训练速度和更好的性能。其论文—具有动态学习率的自适应梯度方法—已被 ICLR 2019 接受以下是网站：https：//www.luolc.com/publications/adabound/GitHub：https：//github.com/Luolc/AdaBound公开评论：https：//openreview.net/forum？id = Bkg3g2R9FX以下是论文摘要：已经提出了诸如 AdaGrad，RMSprop 和 Adam 之类的自适应优化方法来实现快速训练过程，其具有关于学习速率的元素缩放项。尽管普遍存在，但与 SGD 相比，它们的概括性较差，甚至由于不稳定和极端的学习率而未能收敛。最近的工作提出了一些算法，如 AMSGrad，以解决这个问题，但他们未能取得相对于现有方法的显着改进。在我们的论文中，我们证明极端学习率会导致表现不佳。我们提供了 Adam 和 AMSGrad 的新变体，分别称为 AdaBound 和 AMSBound，它们利用学习速率的动态界限来实现从自适应方法到 SGD 的渐进和平滑过渡，并给出收敛的理论证明。我们进一步对各种流行的任务和模型进行实验，这在以前的工作中往往是不够的。实验结果表明，新变种可以消除自适应方法与 SGD 之间的泛化差距，同时在训练早期保持较高的学习速度。此外，它们可以对原型进行重大改进，尤其是在复杂的深度网络上。该算法的实现可以在 https://github.com/Luolc/AdaBound 找到。,"[('AdaBound', 0.24397484699795918), ('https', 0.24397484699795918), ('com', 0.18298113524846937), ('SGD', 0.18298113524846937), ('学习', 0.17685060664010205)]"
25,日本 AI 创企 Preferred Networks 建立快速原型制作设备Mechano-Workshop,机器之心获悉，日本 AI 创企Preferred Networks在其总部附近建立了快速原型制作设备Mechano-Workshop，以快速制造和测试机器人硬件。由于计算机模拟无法捕捉真实环境的所有细节，因此该公司打算用该设备快速制作硬件原型并确认其在现实世界中的移动方式。 Preferred Networks认为，通过重复快速原型设计和改进的加速循环，软件开发的速度可以应用于其硬件开发。此外，该公司希望通过提供一个软件和硬件工程师可以密切合作并相互学习的地方来加速新的技术创新。,"[('硬件', 0.4320109794892308), ('原型', 0.32212402741692303), ('Preferred', 0.30653250007435895), ('Networks', 0.30653250007435895), ('快速', 0.2952240859076923)]"
26,龙加智科技与SiFive达成合作，共同开发人工智能处理器平台,商用RISC-V处理器核心IP、设计平台和芯片解决方案的领导者SiFive宣布，与人工智能处理器、高性能任务关键型应用软件的创新公司DinoplusAI达成合作。两家公司将共同开发具有超低延迟的高性能处理的关键任务人工智能处理器平台，针对超低延迟应用发挥极致效能，可应用在数据中心、5G/边缘云和自动驾驶汽车等产品中。,"[('处理器', 0.5703520607399999), ('超低', 0.37231209430235296), ('人工智能', 0.3709029959015686), ('高性能', 0.3488914253345098), ('延迟', 0.34585385439176475)]"
27,SAP推出面向工业物联网的Leonardo IoT,本周在巴塞罗那举行的世界移动通信大会（MWC）上，SAP宣布推出SAP Leonardo Internet of Things（IoT）功能，并扩大了与微软在物联网互操作性方面的合作。SAP将SAP Leonardo IoT称为「为工业物联网和工业4.0促进和推动数字化转型的全方位技术」，产品专注于工业物联网，让客户可以收集来自机器、产品、供应链、消费者和合作伙伴的洞察。SAP称Leonardo IoT为客户提供了三条「创新途径」：首先是将物联网数据与业务流程数据相结合，以实现物联网嵌入式业务应用；其次是升级现有SAP IoT应用；最后一条路径是构建新的智能物联网解决方案。SAP还公布了SAP Leonardo IoT与Microsoft Azure IoT Hub的云与云之间的互操作性，并表示将为客户提供一个连接和设备管理选择。与微软的新合作关系有望让SAP客户可使用Microsoft Azure IoT Hub作为物联网遥测数据的连接和设备管理层，然后将这些数据转发到SAP Leonardo IoT中。此外，Leonardo IoT Edge将让客户可以选择在Microsoft Azure IoT Edge运行之上扩展对本地业务流程的支持。基于SAP Leonardo IoT Edge的基本业务功能（EBF）模块在未来也将运行在Microsoft Azure IoT Edge的容器之中。,"[('IoT', 0.8747390855780487), ('SAP', 0.8018441617798779), ('Leonardo', 0.510264466587195), ('联网', 0.3130968827657317), ('Microsoft', 0.2915796951926829)]"
28,深挖数据！罗氏旗下AI医疗公司Flatiron Health拓展与FDA的癌症研究合作,2月25日，Flatiron Health宣布将与美国FDA「信息交换与数据传输项目」（INFORMED Program）的合作延长两年，并且拓展在癌症真实数据研究上的合作。此项Flatiron与FDA的合作始于2016年，根据合作内容，Flatiron为FDA提供脱敏的癌症患者数据，帮助后者优化癌症相关的政策和决策。在已经过去的两年间，FDA和Flatiron使用了美国患者的真实数据（real-world evidence）来探究癌症治疗的趋势及其临床成果。深化合作后，双方可以利用这些数据来促进相关法规政策的完善，比如标准化数据质量评判标准、检验可靠的临床试验终点、探索新的分析方法和创新应用。Flatiron是一家总部位于美国纽约的AI医疗科技公司，专注于探索AI技术在各类肿瘤研究和治疗中的应用。其基于AI技术的信息平台可以让研究者和医务人员在掌握肿瘤治疗全局趋势的同时，关注到患者个体的病情变化。一年前，罗氏花费19亿美元将Flatiron收入麾下，也正是看中了其AI技术在药物研发中的巨大潜力。,"[('Flatiron', 0.4981153126208333), ('FDA', 0.33207687508055556), ('AI', 0.33207687508055556), ('癌症', 0.23854087980361113), ('合作', 0.19131000649756946)]"
29,联想发布AI+IoT产品与服务 | MWC 2019,巴塞罗那时间2月25日，联想在MWC大会发布全新AI+IoT产品与服务，由AI+CMP（连接管理）、AI+UEM（设备管理）、AI+IIoT（工业物联网）和AI+IoV（车联网）四部分组成。金融科技相关的例如AI+UEM：推出ThinkUEM智能设备管理平台，提供跨平台、跨系统、跨行业的设备全生命周期管理服务；针对教育、金融、零售、物流等应用场景，灵活定制行业解决方案；未来将通过AI技术提高移动设备安全性和提供数据分析。,"[('AI', 1.19547675029), ('UEM', 0.34156478579714283), ('设备', 0.33149276397714283), ('管理', 0.2671009771325714), ('联网', 0.20958321948400002)]"
30,金融「智变」 中腾信及小花科技自主研发知识图谱并全面应用,金融行业因其与数据的高度相关性，成为人工智能最先应用的行业之一，知识图谱作为人工智能的核心技术，正在加速进入金融领域，并日益成为科技金融的基石。近期，中腾信及旗下小花科技自主研发的知识图谱实现关键性技术重构，并在「小花钱包」全面应用。知识图谱在金融领域一个典型应用是推荐算法，国内领先的就是蚂蚁金服。在其产品线中，无论是好友推荐、内容推荐还是商品推荐都能找到其用武之地，例如大家熟悉的「集五福」、支付宝好友推荐等。国内一些金融科技领先的银行如招商银行，也将知识图谱应用在营销获客领域，通过对已有的客户信息和关系数据进行分析，识别和开拓与现有客户有关联的优质客户，形成高价值客户营销名单和企业画像。,"[('图谱', 0.3546030501416216), ('推荐', 0.24981997252522523), ('金融', 0.23651816888873872), ('知识', 0.23239118614234233), ('客户', 0.22000112128432434)]"
