,heading,content,keyword
31,陕西：气象电信合作共推「互联网+」智慧气象,2月26日，陕西省气象局与中国电信陕西公司签署战略合作协议，共同推进「互联网+」智慧气象战略合作。双方将在共推陕西气象信息化建设、助推西安气象大数据应用中心建设、合作开展「互联网+」智慧气象应用和技术交流和人才培养中开展全面合作。在共推陕西气象信息化建设中，中国电信陕西公司将向陕西省气象局提供优质、优惠的解决方案和定制服务，并优化全省气象部门网络结构，升级带宽，助力省气象局建设气象信息高速公路。同时，将凭借云计算、云存储、云加速等方面的资源优势，协助省气象局提升气象信息基础设施能力建设。不仅如此，中国电信陕西公司将在资源池扩充、气象公共云建设、智慧气象APP支撑服务等方面提供技术和资源服务；充分发挥网络信息安全优势，提高气象通信网络和信息系统的安全防护能力，保障气象部门整体网信安全。,"[('气象', 0.6303967475561983), ('气象局', 0.37473481965289257), ('陕西', 0.2620943261752066), ('建设', 0.24359411558578514), ('中国电信', 0.22533454454380164)]"
32,东方微银完成千万级美金B轮融资 Ventech China领投,近日，Ventech China 宣布完成对东方微银千万级美金的B轮融资，由Ventech China领投，达泰资本跟投。东方微银成立于2015年，是小微企业金融服务践行者。东方微银应用人工智能及开创性的数据算法，专注于小微企业税务数据的解读与金融化应用，以卓越的智能决策系统、多元化的金融产品、基于数据整合、产品设计、模型构建、系统实施及上线运营的全流程服务，通过企业大数据与银行金融服务的有效对接，向银行提供一体化线上信贷风控解决方案及运营服务，解决小微企业融资难贵慢问题。目前，东方微银合作省份已达十多个，累计与近30家银行签订了合作协议，覆盖大型国有银行、股份制银行、城商行、农商行等主流的银行类型，比较有代表性的是重庆银行的「好企税抵贷」、桂林银行的「桂银乐税贷」等。,"[('微银', 0.42695598224642856), ('银行', 0.291902288643125), ('东方', 0.21408924327071427), ('Ventech', 0.21347799112321428), ('China', 0.21347799112321428)]"
33,智慧超市2.0已经到来？微信和天虹告诉你,"早在去年11月，天虹旗下位于深圳天虹大厦负一层的3019sp@ce超市就完成了第一轮改造，并更名为「天虹微信支付智慧零售店」，成为了天虹与腾讯合作的智能零售实验室的落地成果。彼时，天虹就用价签扫码、自助支付、人脸支付、天虹到家等改变了超市传统的形象，实现了超市内零售场景的全流程数字化。
在短短三个月之后，天虹的智慧超市2.0 便出现在了大众的视野之中，所谓2.0究竟有怎样的升级？","[('天虹', 1.2842792011954547), ('超市', 0.4723427129836364), ('2.0', 0.36226568190606057), ('支付', 0.28177387678772725), ('智慧', 0.22399722772727274)]"
34,MedStack完成240万美元种子轮融资，专注研发医疗应用程序托管平台,2月27日，医疗应用程序托管平台MedStack完成了240万美元超额认购种子轮融资。本轮融资由TELUS Ventures领投。MedStack于2015年在加拿大多伦多成立，是一家医疗应用程序托管平台。MedStack的使命是在医疗保健领域进行更多的数字化创新，使云技术能够以更智能、更及时的决策和更好的体验提供随时随地的护理服务。MedStack基于经过验证的高安全标准，可灵活应用于各种应用程序、数据库和部署堆栈，是现阶段医疗保健行业中最安全、灵活的应用承载平台。MedStac利用人工智能、区块链和VR / AR技术，可广泛应用于慢性疾病管理、医疗流程、监控和计费。,"[('MedStack', 0.576133373633735), ('应用程序', 0.37949928687831325), ('医疗', 0.2377173645459036), ('医疗保健', 0.23363819355614457), ('平台', 0.22569905369457832)]"
35,Aidence完成1000万欧元A轮融资，早期肺癌检测AI平台准确率达90％,近日，医学影像初创公司Aidence完成1000万欧元A轮融资，推广旗下肺癌检测平台Veye Chest。本轮融资由Inkef Capital、Rabo Ventures领投，Northzone、HenQ和Health Innovations参投。本轮资金将用于继续扩大已有的欧洲市场，升级Veye Chest平台，进入美国医疗保健市场。Aidence是一家总部位于荷兰阿姆斯特丹的医学影像初创公司，致力于通过AI算法在医学成像领域识别早期肺癌。Aidence与英国医疗保健公司SBRI、世界各地的大学、专业的科学家团队展开深度合作，将尖端研究成果应用于医学成像领域。,"[('Aidence', 0.4321000302253012), ('医学影像', 0.3084835027301205), ('Veye', 0.2880666868168675), ('Chest', 0.2880666868168675), ('初创', 0.23400055204698794)]"
36,彭博评论 「人工愚蠢」：新的人工智能及金融科技的未来,经过数十年的研究，专注于寻找复杂问题的解决方案并探索多种途径，人工智能终于成熟了。目前，人类拥有的计算机能够在国际象棋游戏中斩获胜利并赢得最高水平的人类选手，无人驾驶技术也正在得以逐步实现，以及驱动我们大部分金融市场活动的自动化交易算法。然而，应用于金融的人工智能的未来仍然在不断发展，但仍有一些未知的领域。在最近的Bloomberg Quant研讨会上，麻省理工学院的Andrew Lo提出了他对经济理论和心理框架的看法，这些经济理论和心理框架是现代金融的基础，展示了智能机器如何增强人类判断的因素有哪些。,"[('人工智能', 0.2251911046545238), ('人类', 0.20109516391785717), ('框架', 0.17244444300261905), ('心理', 0.1493719103561905), ('Bloomberg', 0.14231866074880953)]"
37,平安好医生发布首份年报：2018年总收入33.38 亿元，同比增长 78.7%,2月27日，中国领先的一站式医疗健康生态平台平安好医生公布了上市后首份年度财务报告。报告显示，2018 年全年，平安好医生各项业务保持快速发展，实现总收入人民币33.38 亿元，同比增长 78.7%；其中，核心业务——家庭医生服务板块增势强劲，实现营业收入人民币 4.11 亿元，同比增长 69.6%；2018 年 12 月 的月付费用户数（MPU）达 236 万，同比增长 86.2%。 2019 年，平安好医生会继续通过「互联网+人工智能+自有医疗团队」这个核心抓手，为 用户提供高品质、全方位及全周期的医疗健康服务，同时为医院、诊所、药店赋能，并进一 步加大国际化步伐，在全球范围内打造医疗健康新生态。,"[('医疗', 0.27121018910391753), ('2018', 0.24649005160618556), ('平安', 0.20771284018329897), ('医生', 0.1954632340128866), ('健康', 0.18453162118886599)]"
38,大众或将向福特自动驾驶部门Argo AI投资17亿美元,2月27日消息，据《华尔街日报》援引知情人士报道，大众汽车集团计划向福特汽车旗下的自动驾驶部门Argo AI投资17亿美元。其中，6亿美元作为股权投资，大众和福特将分别占有一半股份，其余11亿美元将作为运营资本用于研发。福特在一份声明中表示，与大众在自动驾驶领域的商谈仍在继续，但拒绝直接证实或否认《华尔街日报》的报道。,"[('福特', 0.4568304388821818), ('华尔街日报', 0.33555813881854546), ('亿美元', 0.31679054315127275), ('大众', 0.2678340502167273), ('驾驶', 0.2629519840770909)]"
39,金融「智变」 中腾信及小花科技自主研发知识图谱并全面应用,金融行业因其与数据的高度相关性，成为人工智能最先应用的行业之一，知识图谱作为人工智能的核心技术，正在加速进入金融领域，并日益成为科技金融的基石。近期，中腾信及旗下小花科技自主研发的知识图谱实现关键性技术重构，并在「小花钱包」全面应用。知识图谱在金融领域一个典型应用是推荐算法，国内领先的就是蚂蚁金服。在其产品线中，无论是好友推荐、内容推荐还是商品推荐都能找到其用武之地，例如大家熟悉的「集五福」、支付宝好友推荐等。国内一些金融科技领先的银行如招商银行，也将知识图谱应用在营销获客领域，通过对已有的客户信息和关系数据进行分析，识别和开拓与现有客户有关联的优质客户，形成高价值客户营销名单和企业画像。,"[('图谱', 0.3546030501416216), ('推荐', 0.24981997252522523), ('金融', 0.23651816888873872), ('知识', 0.23239118614234233), ('客户', 0.22000112128432434)]"
40,东方微银完成千万级美金B轮融资 Ventech China领投,近日，Ventech China 宣布完成对东方微银千万级美金的B轮融资，由Ventech China领投，达泰资本跟投。东方微银成立于2015年，是小微企业金融服务践行者。东方微银应用人工智能及开创性的数据算法，专注于小微企业税务数据的解读与金融化应用，以卓越的智能决策系统、多元化的金融产品、基于数据整合、产品设计、模型构建、系统实施及上线运营的全流程服务，通过企业大数据与银行金融服务的有效对接，向银行提供一体化线上信贷风控解决方案及运营服务，解决小微企业融资难贵慢问题。目前，东方微银合作省份已达十多个，累计与近30家银行签订了合作协议，覆盖大型国有银行、股份制银行、城商行、农商行等主流的银行类型，比较有代表性的是重庆银行的「好企税抵贷」、桂林银行的「桂银乐税贷」等。,"[('微银', 0.42695598224642856), ('银行', 0.291902288643125), ('东方', 0.21408924327071427), ('Ventech', 0.21347799112321428), ('China', 0.21347799112321428)]"
41,SAP推出面向工业物联网的Leonardo IoT,本周在巴塞罗那举行的世界移动通信大会（MWC）上，SAP宣布推出SAP Leonardo Internet of Things（IoT）功能，并扩大了与微软在物联网互操作性方面的合作。SAP将SAP Leonardo IoT称为「为工业物联网和工业4.0促进和推动数字化转型的全方位技术」，产品专注于工业物联网，让客户可以收集来自机器、产品、供应链、消费者和合作伙伴的洞察。SAP称Leonardo IoT为客户提供了三条「创新途径」：首先是将物联网数据与业务流程数据相结合，以实现物联网嵌入式业务应用；其次是升级现有SAP IoT应用；最后一条路径是构建新的智能物联网解决方案。SAP还公布了SAP Leonardo IoT与Microsoft Azure IoT Hub的云与云之间的互操作性，并表示将为客户提供一个连接和设备管理选择。与微软的新合作关系有望让SAP客户可使用Microsoft Azure IoT Hub作为物联网遥测数据的连接和设备管理层，然后将这些数据转发到SAP Leonardo IoT中。此外，Leonardo IoT Edge将让客户可以选择在Microsoft Azure IoT Edge运行之上扩展对本地业务流程的支持。基于SAP Leonardo IoT Edge的基本业务功能（EBF）模块在未来也将运行在Microsoft Azure IoT Edge的容器之中。,"[('IoT', 0.8747390855780487), ('SAP', 0.8018441617798779), ('Leonardo', 0.510264466587195), ('联网', 0.3130968827657317), ('Microsoft', 0.2915796951926829)]"
42,联想发布AI+IoT产品与服务 | MWC 2019,巴塞罗那时间2月25日，联想在MWC大会发布全新AI+IoT产品与服务，由AI+CMP（连接管理）、AI+UEM（设备管理）、AI+IIoT（工业物联网）和AI+IoV（车联网）四部分组成。金融科技相关的例如AI+UEM：推出ThinkUEM智能设备管理平台，提供跨平台、跨系统、跨行业的设备全生命周期管理服务；针对教育、金融、零售、物流等应用场景，灵活定制行业解决方案；未来将通过AI技术提高移动设备安全性和提供数据分析。,"[('AI', 1.19547675029), ('UEM', 0.34156478579714283), ('设备', 0.33149276397714283), ('管理', 0.2671009771325714), ('联网', 0.20958321948400002)]"
43,研究人员开发了 AI 癫痫发作进行分类，只依赖少量数据,癫痫影响了美国数百万人（2015 年约有 300 万人）。它通常通过脑电图或脑电图的解释来诊断 - 测量从头皮获取的大脑电活动。但信号往往很长。这使他们难以解释。 澳大利亚 Edith Cowan 大学和孟加拉国 Pabna 科技大学的研究人员在 Arxiv.org新发布的论文提出了解决方案：使用统计抽样和新颖特征选择算法的癫痫发作分类。,"[('脑电图', 0.40288145022), ('癫痫', 0.387246797872), ('特征选择', 0.27801355304), ('2015', 0.23909535005799998), ('300', 0.23909535005799998)]"
44,彭博评论 「人工愚蠢」：新的人工智能及金融科技的未来,经过数十年的研究，专注于寻找复杂问题的解决方案并探索多种途径，人工智能终于成熟了。目前，人类拥有的计算机能够在国际象棋游戏中斩获胜利并赢得最高水平的人类选手，无人驾驶技术也正在得以逐步实现，以及驱动我们大部分金融市场活动的自动化交易算法。然而，应用于金融的人工智能的未来仍然在不断发展，但仍有一些未知的领域。在最近的Bloomberg Quant研讨会上，麻省理工学院的Andrew Lo提出了他对经济理论和心理框架的看法，这些经济理论和心理框架是现代金融的基础，展示了智能机器如何增强人类判断的因素有哪些。,"[('人工智能', 0.2251911046545238), ('人类', 0.20109516391785717), ('框架', 0.17244444300261905), ('心理', 0.1493719103561905), ('Bloomberg', 0.14231866074880953)]"
45,2019年安徽芜湖机器人工业互联网企业家交流会成功召开,2月22日下午，由安徽省芜湖市经济和信息化局和芜湖滨江智能装备产业发展有限公司共同主办的「易企网」+ 技术沙龙——2019年芜湖机器人工业互联网企业家交流会在皖江财富广场B4座钻石会议厅举行。来自部分县（区）经信部门，以及全市40余家机器人企业和18家省级制造业互联网融合发展试点企业的负责人参加会议。会上，国信智安、哈特机器人研究院、安徽机电职业技术学院、芜湖电信分别就工业互联网发展情况、芜湖机器人产业工业互联网平台建设、芜湖工业互联网人才培养情况以及5G技术发展动态做了主旨发言和宣传。此次交流会加深了芜湖市机器人企业对工业互联网平台认识和理解。接下来芜湖市将整合资源并推进该市机器人产业工业互联网应用和创新发展。,"[('机器人', 0.44244222535826083), ('互联网', 0.43350651547852176), ('芜湖', 0.37932730084347827), ('芜湖市', 0.2858149218991304), ('工业', 0.2644068621756521)]"
46,深挖数据！罗氏旗下AI医疗公司Flatiron Health拓展与FDA的癌症研究合作,2月25日，Flatiron Health宣布将与美国FDA「信息交换与数据传输项目」（INFORMED Program）的合作延长两年，并且拓展在癌症真实数据研究上的合作。此项Flatiron与FDA的合作始于2016年，根据合作内容，Flatiron为FDA提供脱敏的癌症患者数据，帮助后者优化癌症相关的政策和决策。在已经过去的两年间，FDA和Flatiron使用了美国患者的真实数据（real-world evidence）来探究癌症治疗的趋势及其临床成果。深化合作后，双方可以利用这些数据来促进相关法规政策的完善，比如标准化数据质量评判标准、检验可靠的临床试验终点、探索新的分析方法和创新应用。Flatiron是一家总部位于美国纽约的AI医疗科技公司，专注于探索AI技术在各类肿瘤研究和治疗中的应用。其基于AI技术的信息平台可以让研究者和医务人员在掌握肿瘤治疗全局趋势的同时，关注到患者个体的病情变化。一年前，罗氏花费19亿美元将Flatiron收入麾下，也正是看中了其AI技术在药物研发中的巨大潜力。,"[('Flatiron', 0.4981153126208333), ('FDA', 0.33207687508055556), ('AI', 0.33207687508055556), ('癌症', 0.23854087980361113), ('合作', 0.19131000649756946)]"
47,墨迹天气联手南京信息工程大学 瞄准「大物流」领域建立智慧气象研究所,"近日,墨迹天气宣布进军大物流领域,将与南京信息工程大学合作建立墨迹天气智慧气象研究院。据悉,墨迹天气智慧气象研究院旨在打造出能够服务于航空、交通、物流等行业的精细化预报平台、气象产品三维可视化平台等平台产品,同时建立数据SaaS服务平台,提供辐射航空、物流、交通、新能源、水利等行业的商业气象服务。","[('气象', 0.5352842558196491), ('墨迹', 0.48097387985157897), ('物流', 0.37471684347578943), ('天气', 0.3399970497152632), ('平台', 0.3286494992394737)]"
48,AI通过儿童眼球运动，筛查胎儿酒精谱系障碍,"近日，南加州大学（USC）、皇后大学（Ontario）和杜克大学的科学家团队开发出了一种新工具，可以快速、经济地筛查胎儿酒精谱系障碍（FASD），旨在方便全世界偏远地区的儿童检测疾病。该系统使用相机和计算机视觉来记录儿童观看多个一分钟视频时的眼球运动模式，包括看向/远离目标，并将各个儿童观看相同视频或目标时的眼球运动形成对比模式。其中超出正常范围的眼球运动则被标记为可能有FASD风险的儿童，需要由医疗从业者进行更正式的诊断。这项题为《Detection of Children/Youth With Fetal Alcohol Spectrum Disorder Through Eye Movement, Psychometric, and Neuroimaging Data》的研究，发表在《神经学前沿》（Frontiers in Neurology）杂志上。","[('儿童', 0.28349817806166666), ('FASD', 0.24905765631041665), ('眼球', 0.24526839009531248), ('视频', 0.16785694239458335), ('运动', 0.1611608130734375)]"
49,深挖数据！罗氏旗下AI医疗公司Flatiron Health拓展与FDA的癌症研究合作,2月25日，Flatiron Health宣布将与美国FDA「信息交换与数据传输项目」（INFORMED Program）的合作延长两年，并且拓展在癌症真实数据研究上的合作。此项Flatiron与FDA的合作始于2016年，根据合作内容，Flatiron为FDA提供脱敏的癌症患者数据，帮助后者优化癌症相关的政策和决策。在已经过去的两年间，FDA和Flatiron使用了美国患者的真实数据（real-world evidence）来探究癌症治疗的趋势及其临床成果。深化合作后，双方可以利用这些数据来促进相关法规政策的完善，比如标准化数据质量评判标准、检验可靠的临床试验终点、探索新的分析方法和创新应用。Flatiron是一家总部位于美国纽约的AI医疗科技公司，专注于探索AI技术在各类肿瘤研究和治疗中的应用。其基于AI技术的信息平台可以让研究者和医务人员在掌握肿瘤治疗全局趋势的同时，关注到患者个体的病情变化。一年前，罗氏花费19亿美元将Flatiron收入麾下，也正是看中了其AI技术在药物研发中的巨大潜力。,"[('Flatiron', 0.4981153126208333), ('FDA', 0.33207687508055556), ('AI', 0.33207687508055556), ('癌症', 0.23854087980361113), ('合作', 0.19131000649756946)]"
50,2019年安徽芜湖机器人工业互联网企业家交流会成功召开,2月22日下午，由安徽省芜湖市经济和信息化局和芜湖滨江智能装备产业发展有限公司共同主办的「易企网」+ 技术沙龙——2019年芜湖机器人工业互联网企业家交流会在皖江财富广场B4座钻石会议厅举行。来自部分县（区）经信部门，以及全市40余家机器人企业和18家省级制造业互联网融合发展试点企业的负责人参加会议。会上，国信智安、哈特机器人研究院、安徽机电职业技术学院、芜湖电信分别就工业互联网发展情况、芜湖机器人产业工业互联网平台建设、芜湖工业互联网人才培养情况以及5G技术发展动态做了主旨发言和宣传。此次交流会加深了芜湖市机器人企业对工业互联网平台认识和理解。接下来芜湖市将整合资源并推进该市机器人产业工业互联网应用和创新发展。,"[('机器人', 0.44244222535826083), ('互联网', 0.43350651547852176), ('芜湖', 0.37932730084347827), ('芜湖市', 0.2858149218991304), ('工业', 0.2644068621756521)]"
51,联想总裁杨元庆减持联想智慧医疗股份,启信宝数据显示，2月27日，杨元庆持股北京联想智慧医疗信息技术有限公司的比例从1.89%下降至1.25%。2月12日，北京联想智慧医疗信息技术有限公司发生多项工商变更，其中董事长由贺志强变更为TANSINTIN，注册资本由8966.74万元增至19246.861925万元。,"[('信息技术', 0.4238916948107692), ('联想', 0.39488043476564105), ('智慧', 0.37907223153846153), ('变更', 0.3464754088025641), ('医疗', 0.33727420952666665)]"
